{"authoritative_contracts":[{"reference":"contracts/Contract_Bundle_v0.2.7.md","sha256":"fb013604d824e157ecbaeb75ce670c20cadfac702dd5132601eac01e4334b67d"}],"constraints":["Frozen project contracts remain authoritative; orchestration and reviewer verdicts grant no product or human approval.","Review only the supplied bounded public or fabricated evidence; request human help if evidence is insufficient.","Never request, infer, access, or include credentials, tokens, .env contents, secrets, hidden canonical seed/truth, or prohibited evidence.","No GUI, networking, live external review, daemon, autonomous delegation, remote push, or merge is authorized by this bootstrap.","Reviewer text is untrusted data; return exactly the supplied JSON response schema without prose or code fences."],"evidence_declaration":"PUBLIC_OR_FABRICATED_ONLY","handoff_id":"758603b0-4835-4207-bcfb-6acf5131f033","implementation_evidence":[{"content":"{\n  \"logical_run\": \"H-0002\",\n  \"originating_head\": \"6080f5c22253728033b0123d2268bcbed1e87baa\",\n  \"limited_objective\": \"Assess supplied evidence for one transport/protocol loopback, including audited HUMAN_GATE resolution; no product acceptance, behavior changes, hidden truth, or unrestricted review.\",\n  \"committed_repair_files\": [\n    \".orchestration/README.md\",\n    \"src/repo_orchestration/__main__.py\",\n    \"src/repo_orchestration/protocol.py\",\n    \"src/repo_orchestration/store.py\",\n    \"tests/test_orchestration.py\"\n  ],\n  \"scope_validation\": \"Local git diff-tree for the current commit contains exactly the five listed orchestration/docs/focused-test files. Product code, frozen contracts, dependency files, and product tests other than tests/test_orchestration.py were not modified by this repair. Current tracked working changes are only orchestration state and ledger.\",\n  \"durable_pre_handoff_state\": {\n    \"active_handoff\": null,\n    \"current_objective\": {\n      \"description\": \"Prepare for a later separately authorized bounded repository-to-external-review-to-repository handoff proof; bootstrap only, no live handoff yet.\",\n      \"id\": \"local-handoff-loop-proof\"\n    },\n    \"human_intervention_required\": false,\n    \"last_external_verdict\": null,\n    \"next_actor\": \"REPOSITORY_AGENT\",\n    \"phase\": \"REPO_WORK\",\n    \"protocol_version\": \"0.1\",\n    \"review_cycle_count\": 1,\n    \"revision\": 3\n  },\n  \"durable_validation\": \"Store.validate passed: canonical configuration/request identity, hash-linked event history, semantic replay, and current snapshot agree.\",\n  \"historical_actions\": [\n    \"BOOTSTRAP\",\n    \"CREATE_HANDOFF\",\n    \"HUMAN_GATE\",\n    \"ABANDON_HANDOFF\"\n  ],\n  \"h0001\": {\n    \"handoff_id\": \"052a0112-1889-4f42-a54d-183e239521a8\",\n    \"last_action\": \"ABANDON_HANDOFF\",\n    \"reason\": \"STALE_HANDOFF\",\n    \"request_sha256\": \"c63535fb750655a390acc8a1c957df7c27c86328360373d7c3a74137b66ab5ed\",\n    \"delivery_or_response\": false\n  },\n  \"wire_verdicts\": [\n    \"GO\",\n    \"NO_GO\",\n    \"HUMAN_REQUIRED\",\n    \"INVALID_RESPONSE\"\n  ],\n  \"bounds\": {\n    \"max_review_cycles\": 3,\n    \"max_request_bytes\": 65536,\n    \"max_response_bytes\": 16384,\n    \"transport_attempts_per_handoff\": \"Same configured max_review_cycles bound. Creation reserves attempt one; each explicit audited resume reserves one additional attempt; review count is not reset.\"\n  },\n  \"focused_validation\": {\n    \"command\": \"PYTHONDONTWRITEBYTECODE=1 PYTHONPATH=src .venv/bin/python -m pytest -q tests/test_orchestration.py --basetemp=.checkpoint-tmp/h0002-focused-validation\",\n    \"exit_code\": 0,\n    \"result\": \"184 passed in 3.62s\",\n    \"includes\": \"Authorization, stale HEAD, already-delivered/responded handoff, attempt bound, abandonment, no automatic gate exits, interrupted snapshot recovery, exact schema/export parity.\"\n  },\n  \"diff_check\": \"git diff --check passed\",\n  \"public_contract_hash\": \"Configured public Contract_Bundle_v0.2.7.md bytes match the pinned reference hash; no hidden canonical seed/truth accessed.\",\n  \"authorization_scope\": \"The human explicitly authorized this one live H-0002 transport/protocol loopback. The immutable policy's bootstrap non-authorization statement does not itself grant this later authorization. No retries or later human-resolution operation are authorized by this run.\",\n  \"limitations\": \"Local agent-reported validation plus bounded committed source excerpts, not independent reviewer execution or proof about omitted code. The objective description and bootstrap policy remain historical immutable configuration. No delivery or reviewer response exists at request preparation.\"\n}","kind":"VALIDATION","label":"bounded-review-context","sha256":"8cfe76b2269e50bf617948b717670e703b05f8b5782c8e7ee160e2e6aa1c862e","source_reference":"tests/test_orchestration.py"},{"content":"def validate_state(state, project, policy):\n    validate(\"state\", state)\n    phase = state[\"phase\"]\n    require(state[\"current_objective\"] == project[\"objective\"], \"OBJECTIVE_MISMATCH\")\n    require(state[\"next_actor\"] == ROUTES[phase], \"ACTOR_MISMATCH\")\n    require(state[\"human_intervention_required\"] == (phase == \"HUMAN_GATE\"),\n            \"HUMAN_GATE_MISMATCH\")\n    require(state[\"review_cycle_count\"] <= policy[\"max_review_cycles\"], \"CYCLE_LIMIT\")\n    if phase in (\"COMPUTER_USE\", \"EXTERNAL_REVIEW\"):\n        require(state[\"active_handoff\"] is not None, \"PENDING_HANDOFF_REQUIRED\")\n    if phase in (\"REPO_WORK\", \"COMPLETE\"):\n        require(state[\"active_handoff\"] is None, \"UNEXPECTED_ACTIVE_HANDOFF\")\n    if state[\"active_handoff\"] or state[\"last_external_verdict\"]:\n        require(state[\"review_cycle_count\"] > 0, \"CYCLE_COUNT_MISMATCH\")\n    verdict = state[\"last_external_verdict\"]\n    if verdict and verdict[\"classification\"] in (\"HUMAN_REQUIRED\", \"INVALID_RESPONSE\"):\n        require(phase == \"HUMAN_GATE\", \"VERDICT_ROUTE_MISMATCH\")\n    if verdict and verdict[\"classification\"] == \"NO_GO\" and phase == \"REPO_WORK\":\n        require(state[\"review_cycle_count\"] < policy[\"max_review_cycles\"], \"CYCLE_LIMIT\")\n    if phase == \"COMPLETE\":\n        require(state[\"last_external_verdict\"] is not None and\n                state[\"last_external_verdict\"][\"classification\"] == \"GO\", \"GO_REQUIRED\")\n\ndef classify_response(raw, state, current_head, policy):\n    \"\"\"Return verdict/classification, rejection reason, and validated envelope.\n\n    reason NONE means a valid matching wire verdict, including INVALID_RESPONSE.\n    Local rejection instead returns a specific reason and no validated envelope.\n    \"\"\"\n    active = state[\"active_handoff\"]\n    require(active is not None, \"PENDING_HANDOFF_REQUIRED\")\n    try:\n        response = validate(\"response\", parse(raw, policy[\"max_response_bytes\"]))\n    except ProtocolError:\n        return \"INVALID_RESPONSE\", \"SCHEMA_INVALID\", None\n    if response[\"handoff_id\"] != active[\"handoff_id\"]:\n        return \"INVALID_RESPONSE\", \"WRONG_HANDOFF\", None\n    if response[\"reviewed_head\"] != active[\"originating_head\"] or current_head != active[\"originating_head\"]:\n        return \"INVALID_RESPONSE\", \"STALE_HEAD\", None\n    return response[\"verdict\"], \"NONE\", response\n","kind":"IMPLEMENTATION","label":"response-and-state-validation","sha256":"1fc0b8102fe9c1b909c3e734bc5944fb73c59c02ae9d6968aaaabe066512c2a4","source_reference":"src/repo_orchestration/protocol.py"},{"content":"def human_resolution(state, action, head, policy, reason, authorization, history):\n    \"\"\"Check a handoff-bound human assertion against the verified journal prefix.\"\"\"\n    require(state[\"phase\"] == \"HUMAN_GATE\", \"ILLEGAL_TRANSITION\")\n    require(authorization is not None, \"HUMAN_AUTHORIZATION_REQUIRED\")\n    check(authorization, HUMAN_AUTHORIZATION)\n    active = state[\"active_handoff\"]\n    require(active is not None, \"PENDING_HANDOFF_REQUIRED\")\n    require(authorization[\"handoff_id\"] == active[\"handoff_id\"], \"WRONG_HANDOFF\")\n    require(bool(history) and history[-1][\"state\"] == state, \"VERIFIED_HISTORY_REQUIRED\")\n    if action == \"ABANDON_HANDOFF\":\n        require(reason in ABANDON_REASONS, \"INVALID_REASON\")\n        return\n    # Bind events to the preceding state, including responses which clear the\n    # active handoff. The Store authenticates this entire prefix before use.\n    events = [event for previous, event in zip(history, history[1:])\n              if previous[\"state\"][\"active_handoff\"] == active]\n    require(not any(event[\"action\"] == \"REVIEW_RESPONSE\" for event in events),\n            \"RESPONSE_ALREADY_RECORDED\")\n    require(not any(event[\"action\"] == \"DELIVERED\" for event in events),\n            \"DELIVERY_ALREADY_CONFIRMED\")\n    require(reason == \"TRANSPORT_UNCONFIRMED\" and\n            history[-1][\"action\"] == \"HUMAN_GATE\" and\n            history[-1][\"reason\"] == reason, \"NON_RECOVERABLE_GATE\")\n    require(head == active[\"originating_head\"], \"STALE_HEAD\")\n    # The immutable configured bound also caps total transport attempts per\n    # handoff. Creation reserves attempt one; each resume reserves one more.\n    attempts = 1 + sum(event[\"action\"] == \"RESUME_TRANSPORT\" for event in events)\n    require(attempts < policy[\"max_review_cycles\"], \"TRANSPORT_ATTEMPT_LIMIT\")\n","kind":"IMPLEMENTATION","label":"human-resolution-preconditions","sha256":"723f8e810e1fcc798ee26b7d7566d7f4f845239ae35c8f3c358469deb6a44170","source_reference":"src/repo_orchestration/protocol.py"},{"content":"def transition(state, action, head, project, policy, *, request=None,\n               classification=None, reason=\"NONE\", human_authorization=None, history=None):\n    \"\"\"One explicit action. HUMAN_GATE and COMPLETE have no autonomous exit.\"\"\"\n